move,text_entry
steamroller,Inflicts regular damage.  Has a $effect_chance% chance to make the target flinch.  Power is doubled against Pokémon that have used minimize since entering the field.
high-horsepower,Inflicts regular damage.
poison-sting,Inflicts regular damage.  Has a $effect_chance% chance to poison the target.
fire-blast,Inflicts regular damage.  Has a $effect_chance% chance to burn the target.
stomp,Inflicts regular damage.  Has a $effect_chance% chance to make the target flinch.  Power is doubled against Pokémon that have used minimize since entering the field.
magnet-bomb,Inflicts regular damage.  Ignores accuracy and evasion modifiers.
crush-grip,"Inflicts regular damage.  Power directly relates to the target's relative remaining HP, given by `1 + 120 * current HP / max HP`, to a maximum of 121."
role-play,"User's ability is replaced with the target's until the user leaves the field.  Ignores accuracy and evasion modifiers.  If the target has flower gift, forecast, illusion, imposter, multitype, stance change, trace, wonder guard, or zen mode, this move will fail.  This move cannot be copied by mirror move."
hyper-voice,Inflicts regular damage.
gravity,"For five turns (including this one), all immunities to ground moves are disabled.  For the duration of this effect, the evasion of every Pokémon on the field is lowered by two stages.  Cancels the effects of bounce, fly, and sky drop.  Specifically, flying Pokémon and those with levitate or that have used magnet rise are no longer immune to ground attacks, arena trap, spikes, or toxic spikes.  bounce, fly, sky drop, high jump kick, jump kick, and splash cannot be used while this move is in effect.  *Bug*: If this move is used during a double or triple battle while Pokémon are under the effect of sky drop, Sky Drop's effect is not correctly canceled on its target, and it remains high in the air indefinitely.  As Sky Drop prevents the target from acting, the only way to subsequently remove it from the field is to faint it."
stone-edge,Inflicts regular damage.  User's critical hit rate is one level higher when using this move.
assurance,"Inflicts regular damage.  If the target takes damage this turn for any reason before this move is used, this move has double power."
mud-slap,Inflicts regular damage.  Has a $effect_chance% chance to lower the target's accuracy by one stage.
toxic-spikes,"Scatters poisoned spikes around the opposing field, which poison opposing Pokémon that enter the field.  A second layer of these spikes may be laid down, in which case Pokémon will be badly poisoned instead.  Pokémon immune to either ground moves or being poisoned are immune to this effect.  Pokémon otherwise immune to ground moves are affected during gravity.  If a poison Pokémon not immune to ground moves enters a field covered with poisoned spikes, the spikes are removed.  rapid spin will remove this effect from its user's side of the field.  defog will remove this effect from its target's side of the field.  This move does not trigger synchronize, unless the Pokémon with synchronize was forced to enter the field by another effect such as roar.  Pokémon entering the field due to baton pass are not affected by this effect."
double-team,Raises the user's evasion by one stage.
icicle-spear,"Inflicts regular damage.  Hits 2–5 times in one turn.  Has a 3/8 chance each to hit 2 or 3 times, and a 1/8 chance each to hit 4 or 5 times.  Averages to 3 hits per use."
mean-look,"The target cannot switch out normally.  Ignores accuracy and evasion modifiers.  This effect ends when the user leaves the field.  The target may still escape by using baton pass, u turn, or a shed shell.  Both the user and the target pass on this effect with baton pass."
flame-wheel,"Inflicts regular damage.  Has a $effect_chance% chance to burn the target.  Frozen Pokémon may use this move, in which case they will thaw."
feint-attack,Inflicts regular damage.  Ignores accuracy and evasion modifiers.
searing-shot,Inflicts regular damage.  Has a $effect_chance% chance to burn the target.
bolt-strike,Inflicts regular damage.  Has a $effect_chance% chance to paralyze the target.
teeter-dance,Confuses all targets.
swords-dance,Raises the user's Attack by two stages.
dragon-tail,"Inflicts regular damage, then switches the target out for another of its trainer's Pokémon, selected at random.  If the target is under the effect of ingrain or suction cups, or it has a substitute, or its Trainer has no more usable Pokémon, it will not be switched out.  If the target is a wild Pokémon, the battle ends instead."
fake-out,Inflicts regular damage.  Causes the target to flinch.  Can only be used on the user's first turn after entering the field.
storm-throw,Inflicts regular damage.  Always scores a critical hit.
leaf-tornado,Inflicts regular damage.  Has a $effect_chance% chance to lower the target's accuracy by one stage.
poison-powder,Poisons the target.
strength,Inflicts regular damage.
doom-desire,"Inflicts typeless regular damage at the end of the third turn, starting with this one.  This move cannot score a critical hit.  If the target switches out, its replacement will be hit instead.  Damage is calculated at the time this move is used; stat changes and switching out during the delay won't change the damage inflicted.  No move with this effect can be used against the same target again until after the end of the third turn.  This effect breaks through wonder guard.  If the target is protected by protect or detect on the turn this move is used, this move will fail.  However, the damage on the third turn will break through protection.  The damage is applied at the end of the turn, so it ignores endure and focus sash.  This move cannot be copied by mirror move."
scary-face,Lowers the target's Speed by two stages.
calm-mind,Raises the user's Special Attack and Special Defense by one stage each.
shadow-force,"Inflicts regular damage.  User vanishes for one turn, becoming immune to attack, and hits on the second turn.  This move ignores the effects of detect and protect.  This move cannot be selected by sleep talk."
cotton-spore,Lowers the target's Speed by two stages.
iron-head,Inflicts regular damage.  Has a $effect_chance% chance to make the target flinch.
triple-axel,Inflicts regular damage.
heal-bell,Removes major status effects and confusion from every Pokémon in the user's party.
forests-curse,Adds grass to the target's types.
flame-charge,Inflicts regular damage.  Raises the user's Speed by one stage.
sky-attack,Inflicts regular damage.  User charges for one turn before attacking.  Critical hit chance is one level higher than normal.  Has a $effect_chance% chance to make the target flinch.  This move cannot be selected by sleep talk.
apple-acid,The user attacks the target with an acidic liquid created from tart apples. This also lowers the target’s Sp. Def stat.
spiky-shield,Blocks damaging attacks and damages attacking Pokémon for 1/8 their max HP.
aqua-tail,Inflicts regular damage.
quick-guard,"Moves with priority greater than 0 will not hit friendly Pokémon for the remainder of this turn.  If the user is last to act this turn, this move will fail.  This move cannot be selected by assist or metronome."
heat-wave,Inflicts regular damage.  Has a $effect_chance% chance to burn the target.
iron-defense,Raises the user's Defense by two stages.
clanging-scales,Inflicts regular damage.  Lowers the user's Defense by one stage.
magma-storm,"Inflicts regular damage.  For the next 2–5 turns, the target cannot leave the field and is damaged for 1/16 its max HP at the end of each turn.  The user continues to use other moves during this time.  If the user leaves the field, this effect ends.  Has a 3/8 chance each to hit 2 or 3 times, and a 1/8 chance each to hit 4 or 5 times.  Averages to 3 hits per use.  rapid spin cancels this effect."
dark-pulse,Inflicts regular damage.  Has a $effect_chance% chance to make the target flinch.
poison-gas,Poisons the target.
twineedle,Inflicts regular damage.  Hits twice in the same turn.  Has a $effect_chance% chance to poison the target.
meteor-assault,"Inflicts regular damage.  User loses its next turn to ""recharge"", and cannot attack or switch out during that turn."
lick,Inflicts regular damage.  Has a $effect_chance% chance to paralyze the target.
superpower,"Inflicts regular damage, then lowers the user's Attack and Defense by one stage each."
dragon-dance,Raises the user's Attack and Speed by one stage each.
darkest-lariat,"Inflicts regular damage.  Damage calculation ignores the target's stat modifiers, including evasion."
rapid-spin,"Inflicts regular damage.  Removes leech seed from the user, frees the user from bind, clamp, fire spin, magma storm, sand tomb, whirlpool, and wrap, and clears spikes, stealth rock, and toxic spikes from the user's side of the field.  If this move misses or has no effect, its effect doesn't activate."
wrap,"Inflicts regular damage.  For the next 2–5 turns, the target cannot leave the field and is damaged for 1/16 its max HP at the end of each turn.  The user continues to use other moves during this time.  If the user leaves the field, this effect ends.  Has a 3/8 chance each to hit 2 or 3 times, and a 1/8 chance each to hit 4 or 5 times.  Averages to 3 hits per use.  rapid spin cancels this effect."
vice-grip,Inflicts regular damage.
fishious-rend,"The user rends the target with its hard gills. If the user attacks before the target, the power of this move is doubled."
mega-punch,Inflicts regular damage.
spotlight,"For the duration of the turn, if the target is also a valid target for a move used by one of its opponents, that move will target it instead."
after-you,"The target will act next this turn, regardless of Speed or move priority. If the target has already acted this turn, this move will fail."
withdraw,Raises the user's Defense by one stage.
diamond-storm,Inflicts regular damage.  Has a $effect_chance% chance to raise the user's Defense by two stages for each target hit.
seismic-toss,"Inflicts damage equal to the user's level.  Type immunity applies, but other type effects are ignored."
mist-ball,Inflicts regular damage.  Has a $effect_chance% chance to lower the target's Special Attack by one stage.
belly-drum,"User pays half its max HP to raise its Attack to +6 stages.  If the user cannot pay the HP cost, this move will fail."
smack-down,"Inflicts regular damage.  Removes the target's immunity to ground-type damage.  This effect removes any existing Ground immunity due to levitate, magnet rise, or telekinesis, and causes the target's flying type to be ignored when it takes Ground damage.  If the target isn't immune to Ground damage, this move will fail.  This move can hit Pokémon under the effect of bounce, fly, or sky drop, and ends the effect of Bounce or Fly."
court-change,"With its mysterious power, the user swaps the effects on either side of the field."
reflect,"Erects a barrier around the user's side of the field that reduces damage from physical attacks by half for five turns.  In double battles, the reduction is 1/3.  Critical hits are not affected by the barrier.  If the user is holding light clay, the barrier lasts for eight turns.  brick break or defog used by an opponent will destroy the barrier."
confuse-ray,Confuses the target.
sketch,"Permanently replaces itself with the target's last used move.  If that move is chatter or struggle, this move will fail.  This move cannot be copied by mimic or mirror move, nor selected by assist or metronome, nor forced by encore."
fire-pledge,"Inflicts regular damage.  If a friendly Pokémon used water pledge earlier this turn, moves used by any friendly Pokémon have doubled effect chance for four turns (including this one)."
eerie-impulse,Lowers the target's Special Attack by two stages.
night-daze,Inflicts regular damage.  Has a $effect_chance% chance to lower the target's accuracy by one stage.
grav-apple,Inflicts regular damage.  Lowers the target's Defense by one stage.
nightmare,"Only works on sleeping Pokémon.  Gives the target a nightmare, damaging it for 1/4 its max HP every turn.  If the target wakes up or leaves the field, this effect ends."
mind-reader,"If the user targets the same target again before the end of the next turn, the move it uses is guaranteed to hit.  This move itself also ignores accuracy and evasion modifiers.  One-hit KO moves are also guaranteed to hit, as long as the user is equal or higher level than the target.  This effect also allows the user to hit Pokémon that are off the field due to moves such as dig or fly.  If the target uses detect or protect while under the effect of this move, the user is not guaranteed to hit, but has a (100 - accuracy)% chance to break through the protection.  This effect is passed on by baton pass."
baby-doll-eyes,Lowers the target's Attack by one stage.
sleep-powder,Puts the target to sleep.
ominous-wind,Inflicts regular damage. Has a $effect_chance% chance to raise all of the user's stats one stage.
bolt-beak,"The user stabs the target with its electrified beak. If the user attacks before the target, the power of this move is doubled."
block,"The target cannot switch out normally.  Ignores accuracy and evasion modifiers.  This effect ends when the user leaves the field.  The target may still escape by using baton pass, u turn, or a shed shell.  Both the user and the target pass on this effect with baton pass."
flower-shield,Raises the Defense of all grass Pokémon in battle.
flash,Lowers the target's accuracy by one stage.
wish,"At the end of the next turn, user will be healed for half its max HP.  If the user is switched out, its replacement will be healed instead for half of the user's max HP.  If the user faints or is forcefully switched by roar or whirlwind, this effect will not activate."
mind-blown,"Inflicts damage, and the user takes damage equal to half of its max HP, rounded up. The user still takes damage if the move is blocked by Protect or Substitute, misses, or if the target has Flash Fire."
sludge,Inflicts regular damage.  Has a $effect_chance% chance to poison the target.
tail-glow,Raises the user's Special Attack by three stages.
dual-wingbeat,Inflicts regular damage.
snarl,Inflicts regular damage.  Has a $effect_chance% chance to lower the target's Special Attack by one stage.
sonic-boom,Inflicts exactly 20 damage.
teleport,Does nothing.  Wild battles end immediately.
minimize,Raises the user's evasion by two stages.  stomp and steamroller have double power against Pokémon that have used this move since entering the field.
blizzard,"Inflicts regular damage.  Has a $effect_chance% chance to freeze the target.  During hail, this move has 100% accuracy.  It also has a (100 - accuracy)% chance to break through the protection of protect and detect."
head-smash,Inflicts regular damage.  User takes 1/2 the damage it inflicts in recoil.
secret-sword,"Inflicts regular damage.  Damage calculation always uses the target's Defense, regardless of this move's damage class."
bulldoze,Inflicts regular damage.  Has a $effect_chance% chance to lower the target's Speed by one stage.
powder-snow,Inflicts regular damage.  Has a $effect_chance% chance to freeze the target.
tri-attack,"Inflicts regular damage.  Has a $effect_chance% chance to burn, freeze, or paralyze the target.  One of these effects is selected at random; they do not each have independent chances to occur."
fling,"Inflicts regular damage.  Power and type are determined by the user's held item.  The item is consumed.  If the user is not holding an item, or its item has no set type and power, this move will fail.  This move ignores sticky hold.  If the user is under the effect of embargo, this move will fail."
scald,Inflicts regular damage.  Has a $effect_chance% chance to burn the target.
brick-break,"Destroys any light screen or reflect on the target's side of the field, then inflicts regular damage."
swallow,"Heals the user depending on the amount of energy stored by stockpile: 1/4 its max HP after one use, 1/2 its max HP after two uses, or fully after three uses.  Stored energy is consumed, and the user's Defense and Special Defense are reset to what they would be if stockpile had not been used.  If the user has no energy stored, this move will fail."
techno-blast,"Inflicts regular damage.  If the user is holding a plate or a drive, this move's type is the type corresponding to that item.  Note: This effect is technically shared by both techno blast and judgment; however, Techno Blast is only affected by drives, and Judgment is only affected by plates."
leer,Lowers the target's Defense by one stage.
haze,"Removes stat, accuracy, and evasion modifiers from every Pokémon on the field.  This does not count as a stat reduction for the purposes of clear body or white smoke."
dragon-rage,Inflicts exactly 40 damage.
synthesis,"Heals the user for half its max HP.  During sunny day, the healing is increased to 2/3 max HP.  During hail, rain dance, or sandstorm, the healing is decreased to 1/4 max HP."
thousand-waves,Inflicts regular damage.  Traps the target.
astonish,Inflicts regular damage.  Has a $effect_chance% chance to make the target flinch.
anchor-shot,Inflicts regular damage.  Traps the target.
arm-thrust,"Inflicts regular damage.  Hits 2–5 times in one turn.  Has a 3/8 chance each to hit 2 or 3 times, and a 1/8 chance each to hit 4 or 5 times.  Averages to 3 hits per use."
skull-bash,Inflicts regular damage.  Raises the user's Defense by one stage.  User then charges for one turn before attacking.  This move cannot be selected by sleep talk.
water-shuriken,Inflicts regular damage.  Hits 2–5 times.
dragon-ascent,"Inflicts regular damage, then lowers the user's Defense and Special Defense by one stage each."
plasma-fists,Inflicts regular damage.
misty-terrain,"For five turns, protects all Pokémon on the ground from major status ailments and confusion and weakens dragon moves used against them to 0.5× their power.  Changes nature power to moonblast."
ice-shard,Inflicts regular damage.
grassy-glide,Inflicts regular damage.
drum-beating,Inflicts regular damage.  Has a $effect_chance% chance to lower the target's Speed by one stage.
blaze-kick,Inflicts regular damage.  User's critical hit rate is one level higher when using this move. Has a $effect_chance% chance to burn the target.
rising-voltage,Inflicts regular damage.
mirror-coat,"Targets the last opposing Pokémon to hit the user with a special move this turn.  Inflicts twice the damage that move did to the user.  If there is no eligible target, this move will fail.  Type immunity applies, but other type effects are ignored.  This move cannot be copied by mirror move, nor selected by assist or metronome."
crafty-shield,"Protects all friendly Pokémon from non-damaging moves for the rest of the turn.  Unlike other blocking moves, this move may be used consecutively without its chance of success falling."
quiver-dance,"Raises the user's Special Attack, Special Defense, and Speed by one stage each."
encore,"The next 4–8 times (selected at random) the target attempts to move, it is forced to repeat its last used move.  If the selected move allows the trainer to select a target, an opponent will be selected at random each turn.  If the target is prevented from using the selected move by some other effect, struggle will be used instead.  This effect ends if the selected move runs out of PP.  If the target hasn't used a move since entering the field, if it tried to use a move this turn and failed, if it does not know the selected move, or if the selected move has 0 PP remaining, this move will fail.  If the target's last used move was encore, mimic, mirror move, sketch, struggle, or transform, this move will fail."
wing-attack,Inflicts regular damage.
fiery-dance,Inflicts regular damage.  Has a $effect_chance% chance to raise the user's Special Attack by one stage.
fissure,"Inflicts damage equal to the target's max HP.  Ignores accuracy and evasion modifiers.  This move's accuracy is 30% plus 1% for each level the user is higher than the target.  If the user is a lower level than the target, this move will fail.  Because this move inflicts a specific and finite amount of damage, endure still prevents the target from fainting.  The effects of lock on, mind reader, and no guard still apply, as long as the user is equal or higher level than the target.  However, they will not give this move a chance to break through detect or protect."
soak,"Changes the target to pure water-type until it leaves the field.  If the target has multitype, this move will fail."
thief,"Inflicts regular damage.  If the target is holding an item and the user is not, the user will permanently take the item.  Damage is still inflicted if an item cannot be taken.  Pokémon with sticky hold or multitype are immune to the item theft effect.  The target cannot recover its item with recycle.  This move cannot be selected by assist or metronome."
heart-swap,User swaps its stat modifiers with the target.
flare-blitz,"Inflicts regular damage.  User takes 1/3 the damage it inflicts in recoil.  Has a $effect_chance% chance to burn the target.  Frozen Pokémon may use this move, in which case they will thaw."
v-create,"Inflicts regular damage.  Lowers the user's Defense, Special Defense, and Speed by one stage each."
false-swipe,Inflicts regular damage.  Will not reduce the target's HP below 1.
smelling-salts,"Inflicts regular damage.  If the target is paralyzed, this move has double power, and the target is cured of its paralysis."
sand-attack,Lowers the target's accuracy by one stage.
body-press,"The user attacks by slamming its body into the target. The higher the user’s Defense, the more damage it can inflict on the target."
magnetic-flux,Raises the Defense and Special Defense of all friendly Pokémon with plus or minus by one stage.
sludge-bomb,Inflicts regular damage.  Has a $effect_chance% chance to poison the target.
ember,Inflicts regular damage.  Has a $effect_chance% chance to burn the target.
rototiller,Raises the Attack and Special Attack of all grass Pokémon in battle.
comet-punch,"Inflicts regular damage.  Hits 2–5 times in one turn.  Has a 3/8 chance each to hit 2 or 3 times, and a 1/8 chance each to hit 4 or 5 times.  Averages to 3 hits per use."
growl,Lowers the target's Attack by one stage.
water-pulse,Inflicts regular damage.  Has a $effect_chance% chance to confuse the target.
tickle,Lowers the target's Attack and Defense by one stage.
heavy-slam,"Inflicts regular damage.  The greater the user's weight compared to the target's, the higher power this move has, to a maximum of 120.  User's weight                    | Power -------------------------------- | ----: Up to 2× the target's weight     |    40 Up to 3× the target's weight     |    60 Up to 4× the target's weight     |    80 Up to 5× the target's weight     |   100 More than 5× the target's weight |   120 "
heart-stamp,Inflicts regular damage.  Has a $effect_chance% chance to make the target flinch.
fury-cutter,"Inflicts regular damage.  Power doubles after every time this move is used, whether consecutively or not, maxing out at 16x.  If this move misses or the user leaves the field, power resets."
stun-spore,Paralyzes the target.
confide,Lowers the target's Special Attack by one stage.
eternabeam,"Inflicts regular damage.  User loses its next turn to ""recharge"", and cannot attack or switch out during that turn."
night-shade,"Inflicts damage equal to the user's level.  Type immunity applies, but other type effects are ignored."
magnet-rise,"For five turns, the user is immune to ground moves.  If the user is under the effect of ingrain or has levitate, this move will fail.  This effect is temporarily disabled by and cannot be used during gravity.  This effect is passed on by baton pass."
horn-attack,Inflicts regular damage.
submission,Inflicts regular damage.  User takes 1/4 the damage it inflicts in recoil.
detect,"No moves will hit the user for the remainder of this turn.  If the user is last to act this turn, this move will fail.  If the user successfully used detect, endure, protect, quick guard, or wide guard on the last turn, this move has a 50% chance to fail.  lock on, mind reader, and no guard provide a (100 – accuracy)% chance for moves to break through this move.  This does not apply to one-hit KO moves (fissure, guillotine, horn drill, and sheer cold); those are always blocked by this move.  thunder during rain dance and blizzard during hail have a 30% chance to break through this move.  The following effects are not prevented by this move:  * acupressure from an ally * curse's curse effect * Delayed damage from doom desire and future sight; however, these moves will be prevented if they are used this turn * feint, which will also end this move's protection after it hits * imprison * perish song * shadow force * Moves that merely copy the user, such as transform or psych up  This move cannot be selected by assist or metronome."
smokescreen,Lowers the target's accuracy by one stage.
earth-power,Inflicts regular damage.  Has a $effect_chance% chance to lower the target's Special Defense by one stage.
mat-block,Protects all friendly Pokémon from damaging moves.  Only works on the first turn after the user is sent out.
acrobatics,"Inflicts regular damage.  If the user has no held item, this move has double power."
baneful-bunker,"Grants the user protection for the rest of the turn.  If a Pokémon attempts to use a move that makes contact with the user, that Pokémon will be poisoned.  This move's chance of success halves every time it's used consecutively with any other protection move."
coil,"Raises the user's Attack, Defense, and accuracy by one stage each."
