move,text_entry
last-resort,"Inflicts regular damage.  This move can only be used if each of the user's other moves has been used at least once since the user entered the field.  If this is the user's only move, this move will fail."
foresight,Resets the target's evasion to normal and prevents any further boosting until the target leaves the field.  A ghost under this effect takes normal damage from normal and fighting moves.  This move itself ignores accuracy and evasion modifiers.
vital-throw,Inflicts regular damage.  Ignores accuracy and evasion modifiers.
thunderbolt,Inflicts regular damage.  Has a $effect_chance% chance to paralyze the target.
gastro-acid,The target's ability is disabled as long as it remains on the field.  This effect is passed on by baton pass.
hydro-pump,Inflicts regular damage.
dazzling-gleam,Inflicts regular damage.
low-kick,"Inflicts regular damage.  Power increases with the target's weight in kilograms, to a maximum of 120.  Target's weight | Power --------------- | ----: Up to 10kg      |    20 Up to 25kg      |    40 Up to 50kg      |    60 Up to 100kg     |    80 Up to 200kg     |   100 Above 200kg     |   120 "
refresh,"Removes a burn, paralysis, or poison from the user."
bind,"Inflicts regular damage.  For the next 2–5 turns, the target cannot leave the field and is damaged for 1/16 its max HP at the end of each turn.  The user continues to use other moves during this time.  If the user leaves the field, this effect ends.  Has a 3/8 chance each to hit 2 or 3 times, and a 1/8 chance each to hit 4 or 5 times.  Averages to 3 hits per use.  rapid spin cancels this effect."
teatime,The user has teatime with all the Pokémon in the battle. Each Pokémon eats its held Berry.
ancient-power,Inflicts regular damage. Has a $effect_chance% chance to raise all of the user's stats one stage.
grass-knot,"Inflicts regular damage.  Power increases with the target's weight in kilograms, to a maximum of 120.  Target's weight | Power --------------- | ----: Up to 10kg      |    20 Up to 25kg      |    40 Up to 50kg      |    60 Up to 100kg     |    80 Up to 200kg     |   100 Above 200kg     |   120 "
thrash,"Inflicts regular damage.  User is forced to attack with this move for 2–3 turns,selected at random.  After the last hit, the user becomes confused.  safeguard does not protect against the confusion from this move."
rock-blast,"Inflicts regular damage.  Hits 2–5 times in one turn.  Has a 3/8 chance each to hit 2 or 3 times, and a 1/8 chance each to hit 4 or 5 times.  Averages to 3 hits per use."
captivate,"Lowers the target's Special Attack by two stages.  If the user and target are the same gender, or either is genderless, this move will fail."
draco-meteor,"Inflicts regular damage, then lowers the user's Special Attack by two stages."
grass-whistle,Puts the target to sleep.
laser-focus,The user's next move will result in a critical hit.
electrify,Changes the target's move's type to electric if it hasn't moved yet this turn.
follow-me,"Until the end of this turn, any moves that opposing Pokémon target solely at the user's ally will instead target the user.  If both Pokémon on the same side of the field use this move on the same turn, the Pokémon that uses it last will become the target.  This effect takes priority over lightning rod and storm drain.  If the user's ally switches out, opposing Pokémon may still hit it with pursuit.  This move cannot be selected by assist or metronome."
echoed-voice,"Inflicts regular damage.  If any friendly Pokémon used this move earlier this turn or on the previous turn, that use's power is added to this move's power, to a maximum of 200."
beak-blast,"Begins charging at the start of the turn, then attacks as normal.  Any Pokémon that makes contact with the user while charging is burned.  The charging is not affected by accuracy, sleep, paralysis, or any other effect that would interfere with a move."
jungle-healing,Inflicts regular damage.
counter,"Targets the last opposing Pokémon to hit the user with a physical move this turn.  Inflicts twice the damage that move did to the user.  If there is no eligible target, this move will fail.  Type immunity applies, but other type effects are ignored.  This move cannot be copied by mirror move, nor selected by assist or metronome."
nuzzle,Inflicts regular damage.  Has a $effect_chance% chance to paralyze the target.
tearful-look,Lowers the target's Attack and Special Attack by one stage each.
sticky-web,"Shoots a web over the opponents' side of the field, which lowers the Speed of any opposing Pokémon that enters the field by one stage.  Pokémon in the air, such as flying-types and those with levitate, are unaffected.  rapid spin removes Sticky Web from the user's side of the field; defog removes it from both sides."
barrage,"Inflicts regular damage.  Hits 2–5 times in one turn.  Has a 3/8 chance each to hit 2 or 3 times, and a 1/8 chance each to hit 4 or 5 times.  Averages to 3 hits per use."
foul-play,Inflicts regular damage.  Damage is calculated using the target's attacking stat rather than the user's.
play-rough,Inflicts regular damage.  Has a $effect_chance% chance to lower the target's Attack by one stage.
solar-blade,"Inflicts regular damage.  User charges for one turn before attacking.  During sunny day, the charge turn is skipped.  During hail, rain dance, or sandstorm, power is halved.  This move cannot be selected by sleep talk."
rain-dance,"Changes the weather to rain for five turns, during which water moves inflict 50% extra damage, and fire moves inflict half damage.  If the user is holding damp rock, this effect lasts for eight turns.  thunder has 100% accuracy.  If the target has used detect or protect, thunder has a (100 - accuracy)% chance to break through the protection.  solar beam has half power.  moonlight, morning sun, and synthesis heal only 1/4 of the user's max HP.  Pokémon with swift swim have doubled original Speed.  Pokémon with forecast become water.  Pokémon with dry skin heal 1/8 max HP, Pokémon with hydration are cured of major status effects, and Pokémon with rain dish heal 1/16 max HP at the end of each turn."
light-screen,"Erects a barrier around the user's side of the field that reduces damage from special attacks by half for five turns.  In double battles, the reduction is 1/3.  Critical hits are not affected by the barrier.  If the user is holding light clay, the barrier lasts for eight turns.  brick break or defog used by an opponent will destroy the barrier."
leaf-blade,Inflicts regular damage.  User's critical hit rate is one level higher when using this move.
tail-whip,Lowers the target's Defense by one stage.
seed-bomb,Inflicts regular damage.
return,"Inflicts regular damage.  Power increases with happiness, given by `happiness * 2 / 5`, to a maximum of 102.  Power bottoms out at 1."
pluck,"Inflicts regular damage.  If the target is holding a berry, this move has double power, and the user takes the berry and uses it immediately.  If the target is holding a jaboca berry or rowap berry, the berry is still removed, but has no effect.  If this move is super effective and the target is holding a berry that can reduce this move's damage, it will do so, and will not be stolen."
zing-zap,Inflicts regular damage.  Has a $effect_chance% chance to make the target flinch.
snipe-shot,"Inflicts regular damage, then (if successful) sets reflect on the user's side of the field."
heal-order,Heals the user for half its max HP.
stealth-rock,"Spreads sharp rocks around the opposing field, damaging any Pokémon that enters the field for 1/8 its max HP.  This damage is affected by the entering Pokémon's susceptibility to rock moves.  rapid spin removes this effect from its user's side of the field."
spike-cannon,"Inflicts regular damage.  Hits 2–5 times in one turn.  Has a 3/8 chance each to hit 2 or 3 times, and a 1/8 chance each to hit 4 or 5 times.  Averages to 3 hits per use."
pin-missile,"Inflicts regular damage.  Hits 2–5 times in one turn.  Has a 3/8 chance each to hit 2 or 3 times, and a 1/8 chance each to hit 4 or 5 times.  Averages to 3 hits per use."
agility,Raises the user's Speed by two stages.
petal-dance,"Inflicts regular damage.  User is forced to attack with this move for 2–3 turns,selected at random.  After the last hit, the user becomes confused.  safeguard does not protect against the confusion from this move."
gust,"Inflicts regular damage.  If the target is under the effect of bounce, fly, or sky drop, this move will hit with double power."
acid-armor,Raises the user's Defense by two stages.
noble-roar,Lowers the target's Attack and Special Attack by one stage.
payback,"Inflicts regular damage.  If the target uses a move or switches out this turn before this move is used, this move has double power."
seed-flare,Inflicts regular damage.  Has a $effect_chance% chance to lower the target's Special Defense by two stages.
fusion-flare,"Inflicts regular damage.  If a friendly Pokémon used fusion bolt earlier this turn, this move has double power."
roar-of-time,"Inflicts regular damage.  User loses its next turn to ""recharge"", and cannot attack or switch out during that turn."
steel-roller,Inflicts regular damage.
baton-pass,"User switches out, and the trainer selects a replacement Pokémon from the party.  Stat changes, confusion, and persistent move effects are passed along to the replacement Pokémon.  The following move effects are passed:  * aqua ring * both the user's and target's effect of block, mean look, and spider web * the curse effect of curse * embargo * focus energy or an activated lansat berry * gastro acid * ingrain * being sapped by leech seed * being targeted by lock on or mind reader * magnet rise * perish song's counter * power trick * substitute; the doll's HP is unchanged  The replacement Pokémon does not trigger effects that respond to Pokémon switching in."
guard-split,Averages the user's unmodified Defense with the target's unmodified Defense; the value becomes the unmodified Defense for both Pokémon. Unmodified Special Defense is averaged the same way.
octazooka,Inflicts regular damage.  Has a $effect_chance% chance to lower the target's accuracy by one stage.
water-spout,"Inflicts regular damage.  Power increases with the user's remaining HP and is given by `150 * HP / max HP`, to a maximum of 150 when the user has full HP."
lovely-kiss,Puts the target to sleep.
leafage,Inflicts regular damage.
memento,Lowers the target's Attack and Special Attack by two stages.  User faints.
air-cutter,Inflicts regular damage.  User's critical hit rate is one level higher when using this move.
recover,Heals the user for half its max HP.
egg-bomb,Inflicts regular damage.
power-trip,"Inflicts regular damage.  Power is increased by 100% its original value for every stage any of the user's stats have been raised.  Accuracy, evasion, and lowered stats do not affect this move's power.  For a Pokémon with all five stats modified to +6, this move's power is 31×."
transform,"User copies the target's species, weight, type, ability, calculated stats (except HP), and moves.  Copied moves will all have 5 PP remaining.  IVs are copied for the purposes of hidden power, but stats are not recalculated.  choice band, choice scarf, and choice specs stay in effect, and the user must select a new move.  This move cannot be copied by mirror move, nor forced by encore."
branch-poke,Inflicts regular damage.
grass-pledge,"Inflicts regular damage.  If a friendly Pokémon used fire pledge earlier this turn, all opposing Pokémon will take 1/8 their max HP in damage at the end of every turn for four turns (including this one)."
final-gambit,Inflicts damage equal to the user's remaining HP.  User faints.
fleur-cannon,"Inflicts regular damage, then lowers the user's Special Attack by two stages."
meteor-beam,Inflicts regular damage.
hex,"Inflicts regular damage.  If the target has a major status ailment, this move has double power."
crush-claw,Inflicts regular damage.  Has a $effect_chance% chance to lower the target's Defense by one stage.
aromatic-mist,Raises a selected ally's Special Defense by one stage.
waterfall,Inflicts regular damage.  Has a $effect_chance% chance to make the target flinch.
aurora-beam,Inflicts regular damage.  Has a $effect_chance% chance to lower the target's Attack by one stage.
taunt,"Target is forced to only use damaging moves for the next 3–5 turns, selected at random.  Moves that select other moves not known in advance do not count as damaging.  assist, copycat, me first, metronome, mirror move, and sleep talk do not directly inflict damage and thus may not be used.  bide, counter, endeavor, metal burst, and mirror coat are allowed."
simple-beam,Changes the target's ability to simple.
substitute,"Transfers 1/4 the user's max HP into a doll that absorbs damage and causes most negative move effects to fail.  If the user leaves the field, the doll will vanish.  If the user cannot pay the HP cost, this move will fail.  The doll takes damage as normal, using the user's stats and types, and will break when its HP reaches zero.  Self-inflicted damage from confusion or recoil is not absorbed.  Healing effects from opponents ignore the doll and heal the user as normal.  Moves that work based on the user's HP still do so; the doll's HP does not influence any move.  The doll will block major status effects, confusion, and flinching.  The effects of smelling salts and wake up slap do not trigger against a doll, even if the Pokémon behind the doll has the appropriate major status effect.  Multi-turn trapping moves like wrap will hit the doll for their regular damage, but the multi-turn trapping and damage effects will not activate.  Moves blocked or damage absorbed by the doll do not count as hitting the user or inflicting damage for any effects that respond to such, e.g., avalanche, counter, or a rowap berry.  magic coat still works as normal, even against moves the doll would block.  Opposing Pokémon that damage the doll with a leech move like absorb are healed as normal.  It will also block acupressure, block, the curse effect of curse, dream eater, embargo, flatter, gastro acid, grudge, heal block, leech seed, lock on, mean look, mimic, mind reader, nightmare, pain split, psycho shift, spider web, sketch, swagger, switcheroo, trick, worry seed, and yawn.  A Pokémon affected by yawn before summoning the doll will still fall to sleep.  The doll blocks intimidate, but all other abilities act as though the doll did not exist.  If the user has an ability that absorbs moves of a certain type for HP (such as volt absorb absorbing thunder wave), such moves will not be blocked.  life orb and berries that cause confusion still work as normal, but their respective HP loss and confusion are absorbed/blocked by the doll.  The user is still vulnerable to damage inflicted when entering or leaving the field, such as by pursuit or spikes; however, the doll will block the poison effect of toxic spikes.  The doll is passed on by baton pass.  It keeps its existing HP, but uses the replacement Pokémon's stats and types for damage calculation.  All other effects work as normal."
perish-song,"Every Pokémon is given a counter that starts at 3 and decreases by 1 at the end of every turn, including this one.  When a Pokémon's counter reaches zero, that Pokémon faints.  A Pokémon that leaves the field will lose its counter; its replacement does not inherit the effect, and other Pokémon's counters remain.  This effect is passed on by baton pass.  This move cannot be copied by mirror move."
leech-seed,Plants a seed on the target that drains 1/8 of its max HP at the end of every turn and heals the user for the amount taken.  Has no effect on grass Pokémon.  The seed remains until the target leaves the field.  The user takes damage instead of being healed if the target has liquid ooze.  rapid spin will remove this effect.  This effect is passed on by baton pass.
heat-crash,"Inflicts regular damage.  The greater the user's weight compared to the target's, the higher power this move has, to a maximum of 120.  User's weight                    | Power -------------------------------- | ----: Up to 2× the target's weight     |    40 Up to 3× the target's weight     |    60 Up to 4× the target's weight     |    80 Up to 5× the target's weight     |   100 More than 5× the target's weight |   120 "
ally-switch,"User switches position on the field with the friendly Pokémon opposite it.  If the user is in the middle position in a triple battle, or there are no other friendly Pokémon, this move will fail."
scale-shot,"Inflicts regular damage two to five times in a row, raising the user's Speed and lowering the user's Defense by one stage each upon last hit."
mimic,"This move is replaced by the target's last successfully used move, and its PP changes to 5.  If the target hasn't used a move since entering the field, if it tried to use a move this turn and failed, or if the user already knows the targeted move, this move will fail.  This effect vanishes when the user leaves the field.  If chatter, metronome, mimic, sketch, or struggle is selected, this move will fail.  This move cannot be copied by mirror move, nor selected by assist or metronome, nor forced by encore."
speed-swap,Exchanges the original Speed stats of the user and target.
force-palm,Inflicts regular damage.  Has a $effect_chance% chance to paralyze the target.
ice-hammer,"Inflicts regular damage, then lowers the user's Speed by one stage."
nature-power,Uses another move chosen according to the terrain.  Terrain                   | Selected move ------------------------- | ------------------ Building                  | tri attack Cave                      | rock slide Deep water                | hydro pump Desert                    | earthquake Grass                     | seed bomb Mountain                  | rock slide Road                      | earthquake Shallow water             | hydro pump Snow                      | blizzard Tall grass                | seed bomb electric terrain | thunderbolt grassy terrain   | energy ball misty terrain    | moonblast  In Pokémon Battle Revolution:  Terrain        | Selected move -------------- | ------------------ Courtyard      | tri attack Crystal        | rock slide Gateway        | hydro pump Magma          | rock slide Main Street    | tri attack Neon           | tri attack Stargazer      | rock slide Sunny Park     | seed bomb Sunset         | earthquake Waterfall      | seed bomb  This move cannot be copied by mirror move.
belch,"Inflicts regular damage.  Can only be used if the user has eaten a berry since the beginning of the battle.  After the user eats a berry, it may use this move any number of times until the end of the battle, even if it switches out.  Eating a held berry, eating a berry via bug bite or pluck, or being the target of a Flung berry will enable this move.  Feeding a Pokémon a berry from the bag or using natural gift will not.  If the trainer chooses this move when it cannot be used, the choice is rejected outright and the trainer must choose another move."
healing-wish,"User faints.  Its replacement's HP is fully restored, and any major status effect is removed.  If the replacement Pokémon is immediately fainted by a switch-in effect, the next replacement is healed by this move instead."
octolock,The user locks the target in and prevents it from fleeing. This move also lowers the target’s Defense and Sp. Def every turn.
psystrike,"Inflicts regular damage.  Damage calculation always uses the target's Defense, regardless of this move's damage class."
clear-smog,Inflicts regular damage.  All of the target's stat modifiers are reset to zero.
giga-impact,"Inflicts regular damage.  User loses its next turn to ""recharge"", and cannot attack or switch out during that turn."
outrage,"Inflicts regular damage.  User is forced to attack with this move for 2–3 turns,selected at random.  After the last hit, the user becomes confused.  safeguard does not protect against the confusion from this move."
poison-fang,Inflicts regular damage.  Has a $effect_chance% chance to badly poison the target.
kings-shield,Blocks damaging attacks and lowers attacking Pokémon's Attack by two stages on contact.  Switches Aegislash to Shield Forme.
bug-buzz,Inflicts regular damage.  Has a $effect_chance% chance to lower the target's Special Defense by one stage.
spider-web,"The target cannot switch out normally.  Ignores accuracy and evasion modifiers.  This effect ends when the user leaves the field.  The target may still escape by using baton pass, u turn, or a shed shell.  Both the user and the target pass on this effect with baton pass."
punishment,"Inflicts regular damage.  Power starts at 60 and is increased by 20 for every stage any of the target's stats has been raised, capping at 200.  Accuracy and evasion modifiers do not increase this move's power."
heal-block,"For the next five turns, the target may not use any moves that only restore HP, and move effects that heal the target are disabled.  Moves that steal HP may still be used, but will only inflict damage and not heal the target."
frost-breath,Inflicts regular damage.  Always scores a critical hit.
flying-press,"Inflicts regular damage.  For the purposes of type effectiveness, this move is both fighting- and flying-type: its final effectiveness is determined by multiplying the effectiveness of each type against each of the target's types.  For all other purposes, this move is pure Fighting-type.  If this move's type is changed, its Fighting typing is overwritten, and its secondary type remains Flying.  If the target has used minimize since entering battle, this move has double power and will never miss."
camouflage,User's type changes according to the terrain.  Terrain        | New type -------------- | -------------- Building       | normal Cave           | rock Desert         | ground Grass          | grass Mountain       | rock Ocean          | water Pond           | water Road           | ground Snow           | ice Tall grass     | grass  In Pokémon Battle Revolution:  Terrain        | New type -------------- | -------------- Courtyard      | normal Crystal        | rock Gateway        | water Magma          | rock Main Street    | normal Neon           | normal Stargazer      | rock Sunny Park     | grass Sunset         | ground Waterfall      | grass 
tail-slap,"Inflicts regular damage.  Hits 2–5 times in one turn.  Has a 3/8 chance each to hit 2 or 3 times, and a 1/8 chance each to hit 4 or 5 times.  Averages to 3 hits per use."
u-turn,"Inflicts regular damage, then the user immediately switches out, and the trainer selects a replacement Pokémon from the party.  If the target faints from this attack, the user's trainer selects the new Pokémon to send out first.  If the user is the last Pokémon in its party that can battle, it will not switch out.  The user may be hit by pursuit when it switches out, if it has been targeted and pursuit has not yet been used.  This move may be used even if the user is under the effect of ingrain.  ingrain's effect will end."
double-kick,Inflicts regular damage.  Hits twice in one turn.
dragon-darts,"The user attacks twice using Dreepy. If there are two targets, this move hits each target once."
prismatic-laser,"Inflicts regular damage.  User loses its next turn to ""recharge"", and cannot attack or switch out during that turn."
precipice-blades,Inflicts regular damage.
weather-ball,"Inflicts regular damage.  If a weather move is active, this move has double power, and its type becomes the type of the weather move.  shadow sky is typeless for the purposes of this move."
obstruct,This move enables the user to protect itself from all attacks. Its chance of failing rises if it is used in succession. Direct contact harshly lowers the attacker’s Defense stat.
roost,"Heals the user for half its max HP.  If the user is flying, its flying type is ignored until the end of this turn."
water-pledge,"Inflicts regular damage.  If a friendly Pokémon used grass pledge earlier this turn, all opposing Pokémon have halved Speed for four turns (including this one)."
lock-on,"If the user targets the same target again before the end of the next turn, the move it uses is guaranteed to hit.  This move itself also ignores accuracy and evasion modifiers.  One-hit KO moves are also guaranteed to hit, as long as the user is equal or higher level than the target.  This effect also allows the user to hit Pokémon that are off the field due to moves such as dig or fly.  If the target uses detect or protect while under the effect of this move, the user is not guaranteed to hit, but has a (100 - accuracy)% chance to break through the protection.  This effect is passed on by baton pass."
burn-up,"Inflicts regular damage.  Removes the user's fire type after damage calculation.  If the user is not fire-type, this move will fail."
sludge-wave,Inflicts regular damage.  Has a $effect_chance% chance to poison the target.
flamethrower,Inflicts regular damage.  Has a $effect_chance% chance to burn the target.
defense-curl,"Raises user's Defense by one stage.  After this move is used, the power of ice ball and rollout are doubled until the user leaves the field."
endure,"The user's HP cannot be lowered below 1 by any means for the remainder of this turn.  If the user successfully used detect, endure, protect, quick guard, or wide guard on the last turn, this move has a 50% chance to fail.  This move cannot be selected by assist or metronome."
rock-smash,Inflicts regular damage.  Has a $effect_chance% chance to lower the target's Defense by one stage.
silver-wind,Inflicts regular damage. Has a $effect_chance% chance to raise all of the user's stats one stage.
